<?xml version='1.0' encoding='UTF-8'?>
<!DOCTYPE dataset SYSTEM "yuimarl.dtd">
<dataset>
  <EVENTVIEW_SPREAD EVENTVIEW_NO="1" SPREAD_DATE="20140101" EVENTSET_NO="1" EVENT_NO="1" START_TIME=" " END_TIME=" " EVENT_CLASS="1" EVENT_TYPE="1" NAME="元日" EVENT_TERM="0"/>
  <EVENTVIEW_SPREAD EVENTVIEW_NO="1" SPREAD_DATE="20140107" EVENTSET_NO="2" EVENT_NO="106" START_TIME="1400" END_TIME="1530" EVENT_CLASS="4" EVENT_TYPE="0" NAME="Weekly1" EVENT_TERM="0"/>
  <EVENTVIEW_SPREAD EVENTVIEW_NO="1" SPREAD_DATE="20140113" EVENTSET_NO="1" EVENT_NO="12" START_TIME=" " END_TIME=" " EVENT_CLASS="1" EVENT_TYPE="3" NAME="成人の日" EVENT_TERM="0"/>
  <EVENTVIEW_SPREAD EVENTVIEW_NO="1" SPREAD_DATE="20140114" EVENTSET_NO="2" EVENT_NO="106" START_TIME="1400" END_TIME="1530" EVENT_CLASS="4" EVENT_TYPE="0" NAME="Weekly1" EVENT_TERM="0"/>
  <EVENTVIEW_SPREAD EVENTVIEW_NO="1" SPREAD_DATE="20140115" EVENTSET_NO="2" EVENT_NO="102" START_TIME="1400" END_TIME="1530" EVENT_CLASS="2" EVENT_TYPE="0" NAME="会議2" EVENT_TERM="0"/>
  <EVENTVIEW_SPREAD EVENTVIEW_NO="1" SPREAD_DATE="20140121" EVENTSET_NO="2" EVENT_NO="106" START_TIME="1400" END_TIME="1530" EVENT_CLASS="4" EVENT_TYPE="0" NAME="Weekly1" EVENT_TERM="0"/>
  <EVENTVIEW_SPREAD EVENTVIEW_NO="1" SPREAD_DATE="20140127" EVENTSET_NO="2" EVENT_NO="108" START_TIME="0615" END_TIME="1200" EVENT_CLASS="5" EVENT_TYPE="11" NAME="Monthly1" EVENT_TERM="0"/>
  <EVENTVIEW_SPREAD EVENTVIEW_NO="1" SPREAD_DATE="20140128" EVENTSET_NO="2" EVENT_NO="106" START_TIME="1400" END_TIME="1530" EVENT_CLASS="4" EVENT_TYPE="0" NAME="Weekly1" EVENT_TERM="0"/>
  <EVENTVIEW_SPREAD EVENTVIEW_NO="1" SPREAD_DATE="20140131" EVENTSET_NO="2" EVENT_NO="110" START_TIME="0615" END_TIME="1200" EVENT_CLASS="5" EVENT_TYPE="11" NAME="Monthly2" EVENT_TERM="0"/>
  <EVENTVIEW_SPREAD EVENTVIEW_NO="1" SPREAD_DATE="20140204" EVENTSET_NO="2" EVENT_NO="106" START_TIME="1400" END_TIME="1530" EVENT_CLASS="4" EVENT_TYPE="0" NAME="Weekly1" EVENT_TERM="0"/>
  <EVENTVIEW_SPREAD EVENTVIEW_NO="1" SPREAD_DATE="20140211" EVENTSET_NO="1" EVENT_NO="2" START_TIME=" " END_TIME=" " EVENT_CLASS="1" EVENT_TYPE="1" NAME="建国記念の日" EVENT_TERM="0"/>
  <EVENTVIEW_SPREAD EVENTVIEW_NO="1" SPREAD_DATE="20140212" EVENTSET_NO="2" EVENT_NO="106" START_TIME="1400" END_TIME="1530" EVENT_CLASS="4" EVENT_TYPE="0" NAME="Weekly1" EVENT_TERM="0"/>
  <EVENTVIEW_SPREAD EVENTVIEW_NO="1" SPREAD_DATE="20140212" EVENTSET_NO="2" EVENT_NO="111" START_TIME="0615" END_TIME="1200" EVENT_CLASS="5" EVENT_TYPE="12" NAME="Monthly3" EVENT_TERM="0"/>
  <EVENTVIEW_SPREAD EVENTVIEW_NO="1" SPREAD_DATE="20140215" EVENTSET_NO="2" EVENT_NO="103" START_TIME="1400" END_TIME="1530" EVENT_CLASS="2" EVENT_TYPE="0" NAME="会議3" EVENT_TERM="0"/>
  <EVENTVIEW_SPREAD EVENTVIEW_NO="1" SPREAD_DATE="20140218" EVENTSET_NO="2" EVENT_NO="106" START_TIME="1400" END_TIME="1530" EVENT_CLASS="4" EVENT_TYPE="0" NAME="Weekly1" EVENT_TERM="0"/>
  <EVENTVIEW_SPREAD EVENTVIEW_NO="1" SPREAD_DATE="20140220" EVENTSET_NO="2" EVENT_NO="114" START_TIME=" " END_TIME=" " EVENT_CLASS="1" EVENT_TYPE="6" NAME="誕生日(49才)" EVENT_TERM="0"/>
  <EVENTVIEW_SPREAD EVENTVIEW_NO="1" SPREAD_DATE="20140225" EVENTSET_NO="2" EVENT_NO="106" START_TIME="1400" END_TIME="1530" EVENT_CLASS="4" EVENT_TYPE="0" NAME="Weekly1" EVENT_TERM="0"/>
  <EVENTVIEW_SPREAD EVENTVIEW_NO="1" SPREAD_DATE="20140228" EVENTSET_NO="2" EVENT_NO="110" START_TIME="0615" END_TIME="1200" EVENT_CLASS="5" EVENT_TYPE="11" NAME="Monthly2" EVENT_TERM="0"/>
  <EVENTVIEW_SPREAD EVENTVIEW_NO="1" SPREAD_DATE="20140303" EVENTSET_NO="1" EVENT_NO="18" START_TIME=" " END_TIME=" " EVENT_CLASS="1" EVENT_TYPE="6" NAME="ひな祭り" EVENT_TERM="0"/>
  <EVENTVIEW_SPREAD EVENTVIEW_NO="1" SPREAD_DATE="20140305" EVENTSET_NO="2" EVENT_NO="106" START_TIME="1400" END_TIME="1530" EVENT_CLASS="4" EVENT_TYPE="0" NAME="Weekly1" EVENT_TERM="0"/>
  <EVENTVIEW_SPREAD EVENTVIEW_NO="1" SPREAD_DATE="20140311" EVENTSET_NO="2" EVENT_NO="106" START_TIME="1400" END_TIME="1530" EVENT_CLASS="4" EVENT_TYPE="0" NAME="Weekly1" EVENT_TERM="0"/>
  <EVENTVIEW_SPREAD EVENTVIEW_NO="1" SPREAD_DATE="20140318" EVENTSET_NO="2" EVENT_NO="106" START_TIME="1400" END_TIME="1530" EVENT_CLASS="4" EVENT_TYPE="0" NAME="Weekly1" EVENT_TERM="0"/>
  <EVENTVIEW_SPREAD EVENTVIEW_NO="1" SPREAD_DATE="20140321" EVENTSET_NO="1" EVENT_NO="16" START_TIME=" " END_TIME=" " EVENT_CLASS="1" EVENT_TYPE="2" NAME="春分の日" EVENT_TERM="0"/>
  <EVENTVIEW_SPREAD EVENTVIEW_NO="1" SPREAD_DATE="20140325" EVENTSET_NO="2" EVENT_NO="106" START_TIME="1400" END_TIME="1530" EVENT_CLASS="4" EVENT_TYPE="0" NAME="Weekly1" EVENT_TERM="0"/>
  <EVENTVIEW_SPREAD EVENTVIEW_NO="1" SPREAD_DATE="20140325" EVENTSET_NO="2" EVENT_NO="108" START_TIME="0615" END_TIME="1200" EVENT_CLASS="5" EVENT_TYPE="11" NAME="Monthly1" EVENT_TERM="0"/>
  <EVENTVIEW_SPREAD EVENTVIEW_NO="1" SPREAD_DATE="20140331" EVENTSET_NO="2" EVENT_NO="110" START_TIME="0615" END_TIME="1200" EVENT_CLASS="5" EVENT_TYPE="11" NAME="Monthly2" EVENT_TERM="0"/>
  <EVENTVIEW_SPREAD EVENTVIEW_NO="1" SPREAD_DATE="20140401" EVENTSET_NO="2" EVENT_NO="106" START_TIME="1400" END_TIME="1530" EVENT_CLASS="4" EVENT_TYPE="0" NAME="Weekly1" EVENT_TERM="0"/>
  <EVENTVIEW_SPREAD EVENTVIEW_NO="1" SPREAD_DATE="20140408" EVENTSET_NO="2" EVENT_NO="106" START_TIME="1400" END_TIME="1530" EVENT_CLASS="4" EVENT_TYPE="0" NAME="Weekly1" EVENT_TERM="0"/>
  <EVENTVIEW_SPREAD EVENTVIEW_NO="1" SPREAD_DATE="20140415" EVENTSET_NO="2" EVENT_NO="106" START_TIME="1400" END_TIME="1530" EVENT_CLASS="4" EVENT_TYPE="0" NAME="Weekly1" EVENT_TERM="0"/>
  <EVENTVIEW_SPREAD EVENTVIEW_NO="1" SPREAD_DATE="20140422" EVENTSET_NO="2" EVENT_NO="106" START_TIME="1400" END_TIME="1530" EVENT_CLASS="4" EVENT_TYPE="0" NAME="Weekly1" EVENT_TERM="0"/>
  <EVENTVIEW_SPREAD EVENTVIEW_NO="1" SPREAD_DATE="20140429" EVENTSET_NO="1" EVENT_NO="4" START_TIME=" " END_TIME=" " EVENT_CLASS="1" EVENT_TYPE="1" NAME="昭和の日" EVENT_TERM="0"/>
  <EVENTVIEW_SPREAD EVENTVIEW_NO="1" SPREAD_DATE="20140430" EVENTSET_NO="2" EVENT_NO="106" START_TIME="1400" END_TIME="1530" EVENT_CLASS="4" EVENT_TYPE="0" NAME="Weekly1" EVENT_TERM="0"/>
  <EVENTVIEW_SPREAD EVENTVIEW_NO="1" SPREAD_DATE="20140430" EVENTSET_NO="2" EVENT_NO="110" START_TIME="0615" END_TIME="1200" EVENT_CLASS="5" EVENT_TYPE="11" NAME="Monthly2" EVENT_TERM="0"/>
  <EVENTVIEW_SPREAD EVENTVIEW_NO="1" SPREAD_DATE="20140503" EVENTSET_NO="1" EVENT_NO="5" START_TIME=" " END_TIME=" " EVENT_CLASS="1" EVENT_TYPE="1" NAME="憲法記念日" EVENT_TERM="0"/>
  <EVENTVIEW_SPREAD EVENTVIEW_NO="1" SPREAD_DATE="20140504" EVENTSET_NO="1" EVENT_NO="7" START_TIME=" " END_TIME=" " EVENT_CLASS="1" EVENT_TYPE="1" NAME="みどりの日" EVENT_TERM="0"/>
  <EVENTVIEW_SPREAD EVENTVIEW_NO="1" SPREAD_DATE="20140505" EVENTSET_NO="1" EVENT_NO="8" START_TIME=" " END_TIME=" " EVENT_CLASS="1" EVENT_TYPE="1" NAME="こどもの日" EVENT_TERM="0"/>
  <EVENTVIEW_SPREAD EVENTVIEW_NO="1" SPREAD_DATE="20140506" EVENTSET_NO="1" EVENT_NO="0" START_TIME=" " END_TIME=" " EVENT_CLASS="2" EVENT_TYPE="5" NAME="振替休日" EVENT_TERM="0"/>
  <EVENTVIEW_SPREAD EVENTVIEW_NO="1" SPREAD_DATE="20140507" EVENTSET_NO="2" EVENT_NO="106" START_TIME="1400" END_TIME="1530" EVENT_CLASS="4" EVENT_TYPE="0" NAME="Weekly1" EVENT_TERM="0"/>
  <EVENTVIEW_SPREAD EVENTVIEW_NO="1" SPREAD_DATE="20140511" EVENTSET_NO="1" EVENT_NO="21" START_TIME=" " END_TIME=" " EVENT_CLASS="1" EVENT_TYPE="7" NAME="母の日" EVENT_TERM="0"/>
  <EVENTVIEW_SPREAD EVENTVIEW_NO="1" SPREAD_DATE="20140513" EVENTSET_NO="2" EVENT_NO="106" START_TIME="1400" END_TIME="1530" EVENT_CLASS="4" EVENT_TYPE="0" NAME="Weekly1" EVENT_TERM="0"/>
  <EVENTVIEW_SPREAD EVENTVIEW_NO="1" SPREAD_DATE="20140513" EVENTSET_NO="2" EVENT_NO="111" START_TIME="0615" END_TIME="1200" EVENT_CLASS="5" EVENT_TYPE="12" NAME="Monthly3" EVENT_TERM="0"/>
  <EVENTVIEW_SPREAD EVENTVIEW_NO="1" SPREAD_DATE="20140520" EVENTSET_NO="2" EVENT_NO="106" START_TIME="1400" END_TIME="1530" EVENT_CLASS="4" EVENT_TYPE="0" NAME="Weekly1" EVENT_TERM="0"/>
  <EVENTVIEW_SPREAD EVENTVIEW_NO="1" SPREAD_DATE="20140526" EVENTSET_NO="2" EVENT_NO="108" START_TIME="0615" END_TIME="1200" EVENT_CLASS="5" EVENT_TYPE="11" NAME="Monthly1" EVENT_TERM="0"/>
  <EVENTVIEW_SPREAD EVENTVIEW_NO="1" SPREAD_DATE="20140527" EVENTSET_NO="2" EVENT_NO="106" START_TIME="1400" END_TIME="1530" EVENT_CLASS="4" EVENT_TYPE="0" NAME="Weekly1" EVENT_TERM="0"/>
  <EVENTVIEW_SPREAD EVENTVIEW_NO="1" SPREAD_DATE="20140531" EVENTSET_NO="2" EVENT_NO="110" START_TIME="0615" END_TIME="1200" EVENT_CLASS="5" EVENT_TYPE="11" NAME="Monthly2" EVENT_TERM="0"/>
  <EVENTVIEW_SPREAD EVENTVIEW_NO="1" SPREAD_DATE="20140603" EVENTSET_NO="2" EVENT_NO="106" START_TIME="1400" END_TIME="1530" EVENT_CLASS="4" EVENT_TYPE="0" NAME="Weekly1" EVENT_TERM="0"/>
  <EVENTVIEW_SPREAD EVENTVIEW_NO="1" SPREAD_DATE="20140610" EVENTSET_NO="2" EVENT_NO="106" START_TIME="1400" END_TIME="1530" EVENT_CLASS="4" EVENT_TYPE="0" NAME="Weekly1" EVENT_TERM="0"/>
  <EVENTVIEW_SPREAD EVENTVIEW_NO="1" SPREAD_DATE="20140615" EVENTSET_NO="1" EVENT_NO="22" START_TIME=" " END_TIME=" " EVENT_CLASS="1" EVENT_TYPE="7" NAME="父の日" EVENT_TERM="0"/>
  <EVENTVIEW_SPREAD EVENTVIEW_NO="1" SPREAD_DATE="20140617" EVENTSET_NO="2" EVENT_NO="106" START_TIME="1400" END_TIME="1530" EVENT_CLASS="4" EVENT_TYPE="0" NAME="Weekly1" EVENT_TERM="0"/>
  <EVENTVIEW_SPREAD EVENTVIEW_NO="1" SPREAD_DATE="20140624" EVENTSET_NO="2" EVENT_NO="106" START_TIME="1400" END_TIME="1530" EVENT_CLASS="4" EVENT_TYPE="0" NAME="Weekly1" EVENT_TERM="0"/>
  <EVENTVIEW_SPREAD EVENTVIEW_NO="1" SPREAD_DATE="20140630" EVENTSET_NO="2" EVENT_NO="110" START_TIME="0615" END_TIME="1200" EVENT_CLASS="5" EVENT_TYPE="11" NAME="Monthly2" EVENT_TERM="0"/>
  <EVENTVIEW_SPREAD EVENTVIEW_NO="1" SPREAD_DATE="20140701" EVENTSET_NO="2" EVENT_NO="106" START_TIME="1400" END_TIME="1530" EVENT_CLASS="4" EVENT_TYPE="0" NAME="Weekly1" EVENT_TERM="0"/>
  <EVENTVIEW_SPREAD EVENTVIEW_NO="1" SPREAD_DATE="20140707" EVENTSET_NO="1" EVENT_NO="19" START_TIME=" " END_TIME=" " EVENT_CLASS="1" EVENT_TYPE="6" NAME="七夕" EVENT_TERM="0"/>